{
 "$schema": "https://json-schema.org/draft/2020-12/schema",
 "title": "US cash bids state/commodity shard",
 "type": "object",
 "required": [
  "schemaVersion",
  "generatedAt",
  "state",
  "commodity",
  "sourceId",
  "series"
 ],
 "properties": {
  "schemaVersion": {
   "type": [
    "integer",
    "string"
   ]
  },
  "generatedAt": {
   "type": "string",
   "pattern": "^\\d{4}-\\d{2}-\\d{2}T\\d{2}:\\d{2}"
  },
  "state": {
   "type": "string",
   "pattern": "^[A-Z]{2}$"
  },
  "commodity": {
   "type": "string",
   "minLength": 1
  },
  "sourceId": {
   "type": "string"
  },
  "breaks": {
   "type": "array",
   "items": {
    "type": "object",
    "required": [
     "date",
     "kind",
     "reportId"
    ],
    "properties": {
     "date": {
      "type": "string"
     },
     "kind": {
      "type": "string",
      "enum": [
       "NEW_DIMENSION",
       "TITLE_CHANGE"
      ]
     },
     "reportId": {
      "type": "integer",
      "minimum": 0
     }
    }
   }
  },
  "series": {
   "type": "array",
   "minItems": 1,
   "items": {
    "type": "object",
    "required": [
     "id",
     "frequency",
     "priceKind",
     "date",
     "freshness",
     "n",
     "first",
     "pts",
     "reportId",
     "state",
     "commodity",
     "locationName",
     "locationType",
     "unit"
    ],
    "properties": {
     "reportId": {
      "type": "integer",
      "minimum": 0
     },
     "state": {
      "type": "string"
     },
     "commodity": {
      "type": "string",
      "minLength": 1
     },
     "commodityName": {
      "type": "string"
     },
     "commodityClass": {
      "type": [
       "string",
       "null"
      ]
     },
     "grade": {
      "type": [
       "string",
       "null"
      ]
     },
     "protein": {
      "type": [
       "string",
       "null"
      ]
     },
     "deliveryPoint": {
      "type": [
       "string",
       "null"
      ]
     },
     "locationName": {
      "type": [
       "string",
       "null"
      ]
     },
     "locationType": {
      "type": "string",
      "enum": [
       "ELEVATOR",
       "TERMINAL",
       "CITY",
       "REGION",
       "STATE",
       "EXPORT_MARKET",
       "UNKNOWN"
      ]
     },
     "freight": {
      "type": [
       "string",
       "null"
      ]
     },
     "saleType": {
      "type": [
       "string",
       "null"
      ]
     },
     "transMode": {
      "type": [
       "string",
       "null"
      ]
     },
     "description": {
      "type": [
       "string",
       "null"
      ]
     },
     "application": {
      "type": [
       "string",
       "null"
      ]
     },
     "deliveryPeriod": {
      "type": [
       "string",
       "null"
      ]
     },
     "currency": {
      "type": [
       "string",
       "null"
      ]
     },
     "unit": {
      "type": "string",
      "minLength": 1
     },
     "id": {
      "type": "string",
      "pattern": "^us-cb:\\d+:[0-9a-f]{10}$"
     },
     "futuresContract": {
      "type": [
       "string",
       "null"
      ]
     },
     "basisUnit": {
      "type": [
       "string",
       "null"
      ]
     },
     "frequency": {
      "type": "string",
      "enum": [
       "daily",
       "weekly"
      ]
     },
     "priceKind": {
      "type": "string",
      "enum": [
       "AVERAGE",
       "EXACT",
       "RANGE",
       "NONE"
      ]
     },
     "date": {
      "type": "string",
      "pattern": "^\\d{4}-\\d{2}-\\d{2}$"
     },
     "pub": {
      "type": [
       "string",
       "null"
      ]
     },
     "avg": {
      "type": [
       "number",
       "null"
      ]
     },
     "lo": {
      "type": [
       "number",
       "null"
      ]
     },
     "hi": {
      "type": [
       "number",
       "null"
      ]
     },
     "bLo": {
      "type": [
       "number",
       "null"
      ]
     },
     "bHi": {
      "type": [
       "number",
       "null"
      ]
     },
     "prevDate": {
      "type": [
       "string",
       "null"
      ]
     },
     "prevAvg": {
      "type": [
       "number",
       "null"
      ]
     },
     "changePct": {
      "type": [
       "number",
       "null"
      ]
     },
     "peerMedianPct": {
      "type": [
       "number",
       "null"
      ]
     },
     "changeFlag": {
      "type": [
       "string",
       "null"
      ],
      "enum": [
       "PEER_OUTLIER",
       null
      ]
     },
     "freshness": {
      "type": "string",
      "enum": [
       "LIVE",
       "FRESH",
       "EXPECTED_DELAY",
       "DELAYED",
       "STALE",
       "HISTORICAL",
       "DISCONTINUED",
       "PENDING"
      ]
     },
     "n": {
      "type": "integer",
      "minimum": 1
     },
     "first": {
      "type": "string"
     },
     "pts": {
      "type": "array",
      "minItems": 1,
      "items": {
       "type": "array",
       "minItems": 6,
       "maxItems": 7
      }
     }
    }
   }
  }
 }
}
