{"schemaVersion":1,"generatedAt":"2026-10-02T23:39:02Z","state":"KY","commodity":"sorghum","sourceId":"usda_ams_mars","series":[{"id":"us-cb:2892:5900395c98","reportId":2892,"state":"KY","commodity":"sorghum","commodityName":"Sorghum","commodityClass":null,"grade":"US #2","protein":null,"deliveryPoint":"Barge Loading Elevators","locationName":"Ohio River - Lower KY","locationType":"TERMINAL","freight":"Delivered","saleType":"Bid","transMode":"Truck","description":null,"application":null,"deliveryPeriod":null,"currency":"USD","unit":"bu","futuresContract":"December (Z)","basisUnit":"¢/Bu","frequency":"daily","priceKind":"AVERAGE","date":"2025-12-29","pub":"2025-12-29T13:27","avg":3.5225,"lo":3.5225,"hi":3.5225,"bLo":-90.0,"bHi":-90.0,"prevDate":"2025-12-23","prevAvg":3.575,"changePct":-1.47,"freshness":"STALE","n":29,"first":"2025-11-13","pts":[["2025-11-13",3.915,3.915,3.915,-50.0,-50.0],["2025-11-14",3.8025,3.8025,3.8025,-50.0,-50.0],["2025-11-17",3.8475,3.8475,3.8475,-50.0,-50.0],["2025-11-18",3.8675,3.8675,3.8675,-50.0,-50.0],["2025-11-19",3.7975,3.7975,3.7975,-50.0,-50.0],["2025-11-20",3.765,3.765,3.765,-50.0,-50.0],["2025-11-21",3.755,3.755,3.755,-50.0,-50.0],["2025-11-24",3.7375,3.7375,3.7375,-50.0,-50.0],["2025-11-25",3.7825,3.7825,3.7825,-60.0,-60.0],["2025-11-26",3.8525,3.8525,3.8525,-60.0,-60.0],["2025-11-28",3.8775,3.8775,3.8775,-60.0,-60.0],["2025-12-01",3.85,3.85,3.85,-60.0,-60.0],["2025-12-02",3.6,3.6,3.6,-90.0,-90.0],["2025-12-03",3.535,3.535,3.535,-90.0,-90.0],["2025-12-04",3.5725,3.5725,3.5725,-90.0,-90.0],["2025-12-05",3.5475,3.5475,3.5475,-90.0,-90.0],["2025-12-08",3.5375,3.5375,3.5375,-90.0,-90.0],["2025-12-09",3.58,3.58,3.58,-90.0,-90.0],["2025-12-10",3.5425,3.5425,3.5425,-90.0,-90.0],["2025-12-11",3.565,3.565,3.565,-90.0,-90.0],["2025-12-12",3.5075,3.5075,3.5075,-90.0,-90.0],["2025-12-15",3.4975,3.4975,3.4975,-90.0,-90.0],["2025-12-16",3.465,3.465,3.465,-90.0,-90.0],["2025-12-17",3.505,3.505,3.505,-90.0,-90.0],["2025-12-18",3.545,3.545,3.545,-90.0,-90.0],["2025-12-19",3.5375,3.5375,3.5375,-90.0,-90.0],["2025-12-22",3.57,3.57,3.57,-90.0,-90.0],["2025-12-23",3.575,3.575,3.575,-90.0,-90.0],["2025-12-29",3.5225,3.5225,3.5225,-90.0,-90.0]],"peerMedianPct":null,"changeFlag":null},{"id":"us-cb:2892:bef8569cc1","reportId":2892,"state":"KY","commodity":"sorghum","commodityName":"Sorghum","commodityClass":null,"grade":"US #2","protein":null,"deliveryPoint":"Barge Loading Elevators","locationName":"Ohio River - Lower KY","locationType":"TERMINAL","freight":"Delivered","saleType":"Bid","transMode":"Truck","description":null,"application":null,"deliveryPeriod":"2025-12-01/2025-12-01","currency":"USD","unit":"bu","futuresContract":"December (Z)","basisUnit":"¢/Bu","frequency":"daily","priceKind":"AVERAGE","date":"2025-11-28","pub":"2025-11-28T14:01","avg":3.8775,"lo":3.8775,"hi":3.8775,"bLo":-60.0,"bHi":-60.0,"prevDate":"2025-11-26","prevAvg":3.8525,"changePct":0.65,"freshness":"STALE","n":11,"first":"2025-11-13","pts":[["2025-11-13",3.915,3.915,3.915,-50.0,-50.0],["2025-11-14",3.8025,3.8025,3.8025,-50.0,-50.0],["2025-11-17",3.8475,3.8475,3.8475,-50.0,-50.0],["2025-11-18",3.8675,3.8675,3.8675,-50.0,-50.0],["2025-11-19",3.7975,3.7975,3.7975,-50.0,-50.0],["2025-11-20",3.765,3.765,3.765,-50.0,-50.0],["2025-11-21",3.755,3.755,3.755,-50.0,-50.0],["2025-11-24",3.7375,3.7375,3.7375,-50.0,-50.0],["2025-11-25",3.7825,3.7825,3.7825,-60.0,-60.0],["2025-11-26",3.8525,3.8525,3.8525,-60.0,-60.0],["2025-11-28",3.8775,3.8775,3.8775,-60.0,-60.0]],"peerMedianPct":null,"changeFlag":null}],"breaks":[]}
