{"schemaVersion":1,"generatedAt":"2026-10-19T23:55:00Z","state":"SD","commodity":"oats","sourceId":"usda_ams_mars","series":[{"id":"us-cb:3186:c192c6b36d","reportId":3186,"state":"SD","commodity":"oats","commodityName":"Oats","commodityClass":null,"grade":"US #2","protein":null,"deliveryPoint":"Country Elevators","locationName":"East Central","locationType":"REGION","freight":"Delivered","saleType":"Bid","transMode":"Truck","description":null,"application":null,"deliveryPeriod":null,"currency":"USD","unit":"bu","futuresContract":null,"basisUnit":null,"frequency":"daily","priceKind":"AVERAGE","date":"2026-10-19","pub":"2026-10-19T13:46","avg":2.7667,"lo":2.7,"hi":2.8,"bLo":null,"bHi":null,"prevDate":"2026-10-16","prevAvg":2.7667,"changePct":0.0,"freshness":"LIVE","n":99,"first":"2026-05-26","pts":[["2026-05-26",2.6,2.6,2.6,null,null],["2026-05-27",2.6,2.6,2.6,null,null],["2026-05-28",2.6,2.6,2.6,null,null],["2026-05-29",2.6,2.6,2.6,null,null],["2026-06-02",2.65,2.6,2.7,null,null],["2026-06-03",2.6333,2.6,2.7,null,null],["2026-06-04",2.6333,2.6,2.7,null,null],["2026-06-05",2.6333,2.6,2.7,null,null],["2026-06-08",2.6333,2.6,2.7,null,null],["2026-06-09",2.6333,2.6,2.7,null,null],["2026-06-10",2.6333,2.6,2.7,null,null],["2026-06-11",2.6333,2.6,2.7,null,null],["2026-06-12",2.6333,2.6,2.7,null,null],["2026-06-15",2.4833,2.45,2.5,null,null],["2026-06-16",2.4833,2.45,2.5,null,null],["2026-06-17",2.4833,2.45,2.5,null,null],["2026-06-18",2.4833,2.45,2.5,null,null],["2026-06-22",2.4833,2.45,2.5,null,null],["2026-06-23",2.4833,2.45,2.5,null,null],["2026-06-24",2.4833,2.45,2.5,null,null],["2026-06-25",2.4833,2.45,2.5,null,null],["2026-06-26",2.4833,2.45,2.5,null,null],["2026-06-29",2.4833,2.45,2.5,null,null],["2026-06-30",2.5333,2.5,2.6,null,null],["2026-07-01",2.5333,2.5,2.6,null,null],["2026-07-02",2.5333,2.5,2.6,null,null],["2026-07-06",2.5333,2.5,2.6,null,null],["2026-07-07",2.5333,2.5,2.6,null,null],["2026-07-09",2.5333,2.5,2.6,null,null],["2026-07-10",2.5333,2.5,2.6,null,null],["2026-07-13",2.5333,2.5,2.6,null,null],["2026-07-14",2.5333,2.5,2.6,null,null],["2026-07-15",2.45,2.4,2.5,null,null],["2026-07-16",2.45,2.4,2.5,null,null],["2026-07-17",2.45,2.4,2.5,null,null],["2026-07-20",2.45,2.4,2.5,null,null],["2026-07-21",2.45,2.4,2.5,null,null],["2026-07-22",2.45,2.4,2.5,null,null],["2026-07-23",2.45,2.4,2.5,null,null],["2026-07-24",2.45,2.4,2.5,null,null],["2026-07-27",2.45,2.4,2.5,null,null],["2026-07-28",2.45,2.4,2.5,null,null],["2026-07-29",2.45,2.4,2.5,null,null],["2026-07-30",2.45,2.4,2.5,null,null],["2026-07-31",2.45,2.4,2.5,null,null],["2026-08-03",2.45,2.4,2.5,null,null],["2026-08-04",2.45,2.4,2.5,null,null],["2026-08-05",2.45,2.4,2.5,null,null],["2026-08-06",2.45,2.4,2.5,null,null],["2026-08-07",2.4,2.4,2.4,null,null],["2026-08-10",2.4,2.4,2.4,null,null],["2026-08-11",2.4,2.4,2.4,null,null],["2026-08-12",2.4,2.4,2.4,null,null],["2026-08-13",2.4,2.4,2.4,null,null],["2026-08-14",2.4,2.4,2.4,null,null],["2026-08-17",2.4,2.4,2.4,null,null],["2026-08-18",2.4,2.4,2.4,null,null],["2026-08-19",2.4,2.4,2.4,null,null],["2026-08-20",2.4,2.4,2.4,null,null],["2026-08-21",2.4,2.4,2.4,null,null],["2026-08-24",2.4,2.4,2.4,null,null],["2026-08-25",2.4,2.4,2.4,null,null],["2026-08-26",2.4,2.4,2.4,null,null],["2026-08-27",2.4,2.4,2.4,null,null],["2026-08-28",2.4,2.4,2.4,null,null],["2026-08-31",2.4,2.4,2.4,null,null],["2026-09-01",2.4,2.4,2.4,null,null],["2026-09-02",2.4,2.4,2.4,null,null],["2026-09-03",2.4,2.4,2.4,null,null],["2026-09-04",2.4,2.4,2.4,null,null],["2026-09-08",2.4,2.4,2.4,null,null],["2026-09-09",2.4,2.4,2.4,null,null],["2026-09-10",2.4,2.4,2.4,null,null],["2026-09-11",2.4,2.4,2.4,null,null],["2026-09-14",2.4,2.4,2.4,null,null],["2026-09-15",2.4,2.4,2.4,null,null],["2026-09-16",2.4,2.4,2.4,null,null],["2026-09-17",2.4,2.4,2.4,null,null],["2026-09-18",2.4,2.4,2.4,null,null],["2026-09-21",2.4,2.4,2.4,null,null],["2026-09-22",2.4,2.4,2.4,null,null],["2026-09-23",2.4,2.4,2.4,null,null],["2026-09-24",2.4,2.4,2.4,null,null],["2026-09-25",2.4,2.4,2.4,null,null],["2026-09-28",2.4,2.4,2.4,null,null],["2026-09-29",2.4,2.4,2.4,null,null],["2026-09-30",2.4,2.4,2.4,null,null],["2026-10-01",2.4,2.4,2.4,null,null],["2026-10-02",2.4,2.4,2.4,null,null],["2026-10-05",2.4,2.4,2.4,null,null],["2026-10-06",2.4,2.4,2.4,null,null],["2026-10-07",2.7667,2.7,2.8,null,null],["2026-10-08",2.7667,2.7,2.8,null,null],["2026-10-09",2.7667,2.7,2.8,null,null],["2026-10-13",2.7667,2.7,2.8,null,null],["2026-10-14",2.7667,2.7,2.8,null,null],["2026-10-15",2.7667,2.7,2.8,null,null],["2026-10-16",2.7667,2.7,2.8,null,null],["2026-10-19",2.7667,2.7,2.8,null,null]],"peerMedianPct":null,"changeFlag":null},{"id":"us-cb:3186:800a017b96","reportId":3186,"state":"SD","commodity":"oats","commodityName":"Oats","commodityClass":null,"grade":"US #2","protein":null,"deliveryPoint":"Country Elevators","locationName":"Northeast","locationType":"REGION","freight":"Delivered","saleType":"Bid","transMode":"Truck","description":null,"application":null,"deliveryPeriod":null,"currency":"USD","unit":"bu","futuresContract":null,"basisUnit":null,"frequency":"daily","priceKind":"AVERAGE","date":"2026-10-19","pub":"2026-10-19T13:46","avg":2.65,"lo":2.6,"hi":2.7,"bLo":null,"bHi":null,"prevDate":"2026-10-16","prevAvg":2.65,"changePct":0.0,"freshness":"LIVE","n":100,"first":"2026-05-26","pts":[["2026-05-26",3.1075,3.0725,3.1425,null,null],["2026-05-27",3.1975,3.1625,3.2325,null,null],["2026-05-28",3.135,3.1,3.17,null,null],["2026-05-29",3.0125,2.9775,3.0475,null,null],["2026-06-01",2.8975,2.8625,2.9325,null,null],["2026-06-02",2.775,2.74,2.81,null,null],["2026-06-03",2.69,2.655,2.725,null,null],["2026-06-04",2.61,2.575,2.645,null,null],["2026-06-05",2.55,2.515,2.585,null,null],["2026-06-08",2.5475,2.5125,2.5825,null,null],["2026-06-09",2.5625,2.5275,2.5975,null,null],["2026-06-10",2.61,2.575,2.645,null,null],["2026-06-11",2.58,2.545,2.615,null,null],["2026-06-12",2.485,2.45,2.52,null,null],["2026-06-15",2.395,2.36,2.43,null,null],["2026-06-16",2.47,2.435,2.505,null,null],["2026-06-17",2.49,2.455,2.525,null,null],["2026-06-18",2.5575,2.5225,2.5925,null,null],["2026-06-22",2.4625,2.4275,2.4975,null,null],["2026-06-23",2.445,2.41,2.48,null,null],["2026-06-24",2.2525,2.2175,2.2875,null,null],["2026-06-25",2.1625,2.1275,2.1975,null,null],["2026-06-26",2.1925,2.1575,2.2275,null,null],["2026-06-29",2.6925,2.6425,2.7425,null,null],["2026-06-30",2.785,2.735,2.835,null,null],["2026-07-01",2.815,2.765,2.865,null,null],["2026-07-02",2.8875,2.8375,2.9375,null,null],["2026-07-06",2.9225,2.8725,2.9725,null,null],["2026-07-07",3.0425,2.9925,3.0925,null,null],["2026-07-09",2.99,2.99,2.99,null,null],["2026-07-10",3.0575,3.0575,3.0575,null,null],["2026-07-13",2.9725,2.9225,3.0225,null,null],["2026-07-14",2.9425,2.8925,2.9925,null,null],["2026-07-15",2.9625,2.9125,3.0125,null,null],["2026-07-16",2.865,2.815,2.915,null,null],["2026-07-17",2.8475,2.7975,2.8975,null,null],["2026-07-20",2.65,2.6,2.7,null,null],["2026-07-21",2.65,2.6,2.7,null,null],["2026-07-22",2.65,2.6,2.7,null,null],["2026-07-23",2.65,2.6,2.7,null,null],["2026-07-24",2.65,2.6,2.7,null,null],["2026-07-27",2.65,2.6,2.7,null,null],["2026-07-28",2.65,2.6,2.7,null,null],["2026-07-29",2.65,2.6,2.7,null,null],["2026-07-30",2.65,2.6,2.7,null,null],["2026-07-31",2.65,2.6,2.7,null,null],["2026-08-03",2.65,2.6,2.7,null,null],["2026-08-04",2.65,2.6,2.7,null,null],["2026-08-05",2.65,2.6,2.7,null,null],["2026-08-06",2.65,2.6,2.7,null,null],["2026-08-07",2.65,2.6,2.7,null,null],["2026-08-10",2.65,2.6,2.7,null,null],["2026-08-11",2.65,2.6,2.7,null,null],["2026-08-12",2.65,2.6,2.7,null,null],["2026-08-13",2.65,2.6,2.7,null,null],["2026-08-14",2.65,2.6,2.7,null,null],["2026-08-17",2.65,2.6,2.7,null,null],["2026-08-18",2.65,2.6,2.7,null,null],["2026-08-19",2.65,2.6,2.7,null,null],["2026-08-20",2.65,2.6,2.7,null,null],["2026-08-21",2.65,2.6,2.7,null,null],["2026-08-24",2.65,2.6,2.7,null,null],["2026-08-25",2.65,2.6,2.7,null,null],["2026-08-26",2.65,2.6,2.7,null,null],["2026-08-27",2.65,2.6,2.7,null,null],["2026-08-28",2.65,2.6,2.7,null,null],["2026-08-31",2.65,2.6,2.7,null,null],["2026-09-01",2.65,2.6,2.7,null,null],["2026-09-02",2.65,2.6,2.7,null,null],["2026-09-03",2.65,2.6,2.7,null,null],["2026-09-04",2.65,2.6,2.7,null,null],["2026-09-08",2.65,2.6,2.7,null,null],["2026-09-09",2.65,2.6,2.7,null,null],["2026-09-10",2.65,2.6,2.7,null,null],["2026-09-11",2.65,2.6,2.7,null,null],["2026-09-14",2.65,2.6,2.7,null,null],["2026-09-15",2.65,2.6,2.7,null,null],["2026-09-16",2.65,2.6,2.7,null,null],["2026-09-17",2.65,2.6,2.7,null,null],["2026-09-18",2.65,2.6,2.7,null,null],["2026-09-21",2.65,2.6,2.7,null,null],["2026-09-22",2.65,2.6,2.7,null,null],["2026-09-23",2.65,2.6,2.7,null,null],["2026-09-24",2.65,2.6,2.7,null,null],["2026-09-25",2.65,2.6,2.7,null,null],["2026-09-28",2.65,2.6,2.7,null,null],["2026-09-29",2.65,2.6,2.7,null,null],["2026-09-30",2.65,2.6,2.7,null,null],["2026-10-01",2.65,2.6,2.7,null,null],["2026-10-02",2.65,2.6,2.7,null,null],["2026-10-05",2.65,2.6,2.7,null,null],["2026-10-06",2.65,2.6,2.7,null,null],["2026-10-07",2.65,2.6,2.7,null,null],["2026-10-08",2.65,2.6,2.7,null,null],["2026-10-09",2.65,2.6,2.7,null,null],["2026-10-13",2.65,2.6,2.7,null,null],["2026-10-14",2.65,2.6,2.7,null,null],["2026-10-15",2.65,2.6,2.7,null,null],["2026-10-16",2.65,2.6,2.7,null,null],["2026-10-19",2.65,2.6,2.7,null,null]],"peerMedianPct":null,"changeFlag":null}],"breaks":[]}
